{
  "$schema": "http://json-schema.org/draft-06/schema#",
  "title": "Transcriptic Samples Format Classification Schema",
  "$comment": "Generated by Genson from examples; Curated by @mweston",
  "type": "object",
  "properties": {
    "challenge_problem": {
      "type": "string"
    },
    "experiment_id": {
      "type": "string"
    },
    "experiment_reference": {
      "type": "string"
    },
    "experimental_start": {
      "type": "string"
    },
    "experimental_end": {
        "type": "string"
    },
    "experimental_reader_params": {
        "type": "array",
        "items": {
            "type": "object",
            "properties": {
                "fluorescence": {
                  "oneOf": [
                  {
                    "type": "array",
                    "items": {
                        "type": "object",
                        "properties": {
                            "emission": {
                                "type": "string"
                            },
                            "excitation": {
                                "type": "string"
                            },
                            "gain": {
                                "type": "number"
                            }
                        },
                        "required": ["emission", "excitation", "gain"]
                    }
                  },
                  {
                    "type": "object",
                    "properties": {
                        "emission": {
                            "type": "string"
                        },
                        "excitation": {
                            "type": "string"
                        },
                        "gain": {
                            "type": "number"
                        }
                    },
                    "required": ["emission", "excitation", "gain"]
                  }]
                },
                "luminescence": {
                    "type": "object",
                    "properties": {
                        "integration_time": {
                            "type": "string"
                        }
                    },
                    "required": ["integration_time"]
                }
            }
        }
    },
    "calibration_reader_params": {
        "type": "array",
        "items": {
            "type": "object",
            "properties": {
                "emission": {
                    "type": "string"
                },
                "excitation": {
                    "type": "string"
                },
                "gain": {
                    "type": "number"
                }
            },
            "required": ["emission", "excitation", "gain"]
        }
    },
    "lab": {
      "type": "string"
    },
    "samples": {
      "type": "array",
      "items": {
        "type": "object",
        "properties": {
          "contents": {
            "oneOf": [{
              "type": "array",
              "items": {
                "type": "string"
              }
            },
            {
              "type":"string"
            },
            {
                "type": "array",
                "items": {
                    "type": "object",
                    "properties": {
                        "label": {
                          "type": "string"
                        },
                        "concentration": {
                          "type": "string"
                        },
                        "timepoint": {
                          "type": "string"
                        }
                    },
                    "additionalProperties": false,
                    "required": [
                        "label"
                    ]
                },
                "minItems": 1
            }]
          },
          "experimental_media": {
            "type": "string"
          },
          "files": {
            "type": "array",
            "items": {
              "type": "object",
              "properties": {
                "name": {
                  "type": "string"
                },
                "sha256": {
                  "type": "string"
                },
                "type": {
                  "type": "string"
                }
              },
              "required": [
                "name",
                "type"
              ]
            }
          },
          "sample_id": {
            "type": "string"
          },
          "strain": {
            "type": "string"
          },
          "temperature": {
            "type": "string"
          },
          "timepoint": {
            "type": "string"
          },
          "tx_sample_id": {
            "type": "string"
          },
          "inoculation_density": {
            "type": "string"
          }
        },
        "required": [
          "files",
          "sample_id",
          "temperature",
          "tx_sample_id"
        ]
      }
    },
    "tasbe_cytometer_configuration": {
      "type": "object",
      "properties": {
        "channels": {
          "type": "array",
          "items": {
            "type": "object",
            "properties": {
              "name": {
                "type": "string"
	          },
	          "emission_filter": {
                "type": "object",
                "properties": {
                  "center": {
                    "type": "integer"
                  },
                  "type": {
                    "type": "string"
                  },
                  "width": {
                    "type": "integer"
                  }
                }
              },
              "excitation_wavelength": {
	            "type": "integer"
              }
	        }
	      }
        }        
      }
    }
  },
  "required": [
    "challenge_problem",
    "experiment_id",
    "experiment_reference",
    "lab",
    "samples"
  ]
}
